,user_id,name,username,description,created_at,followers_count,following_count,following_list,following_agentid_list,previous_tweets,tweets_id,activity_level_frequency,activity_level,user_char
0,868112707,AFP Photo Department,AFPphoto,"AFPphoto is the official Twitter account of Agence France-Presse, dedicated to sharing news and features from its expansive global photo network. Although not verified, it has a substantial following of 36,037 users and engages with 241 friends. The account has posted 4,624 tweets and has garnered 70 likes, providing a worldwide perspective on current events through captivating imagery.",2012-10-08 14:43:38+0000,36037,241,"['114023018', '17652946']",[],['#CharlieHebdo -  11 dead including 2 police in Paris shooting. Photo @MartinBureau1 #AFP http://t.co/aksGP63MB7'],[],"[1.4594594594594594, 1.2342342342342343, 1.4144144144144144, 1.2252252252252251, 1.3513513513513513, 1.3063063063063063, 0.4594594594594595, 0.36036036036036034, 0.35135135135135137, 0.36036036036036034, 0.3063063063063063, 0.5225225225225225, 1.0810810810810811, 1.4144144144144144, 1.5495495495495495, 2.135135135135135, 2.027027027027027, 2.0, 1.5585585585585586, 1.5675675675675675, 2.063063063063063, 1.2792792792792793, 1.2432432432432432, 1.3063063063063063]",[],"AFPphoto is the official Twitter account of Agence France-Presse, dedicated to sharing news and features from its expansive global photo network. Although not verified, it has a substantial following of 36,037 users and engages with 241 friends. The account has posted 4,624 tweets and has garnered 70 likes, providing a worldwide perspective on current events through captivating imagery."
1,2464502209,HIZMET TURCO,HizmetTurco,"HizmetTurco is a political scientist based in Istanbul, Turkey, with a focus on the Hizmet Movement and dialogue initiatives. They are active on social media, engaging with a community of 1,109 followers and have made 30,496 posts. Although their account is not verified, they share insights related to their interests as a Turkish Muslim. HizmetTurco follows 463 accounts and has a collection of 4,262 favorites.",2014-04-26 11:22:11+0000,1109,463,[],[],[],[],"[1.4594594594594594, 1.2342342342342343, 1.4144144144144144, 1.2252252252252251, 1.3513513513513513, 1.3063063063063063, 0.4594594594594595, 0.36036036036036034, 0.35135135135135137, 0.36036036036036034, 0.3063063063063063, 0.5225225225225225, 1.0810810810810811, 1.4144144144144144, 1.5495495495495495, 2.135135135135135, 2.027027027027027, 2.0, 1.5585585585585586, 1.5675675675675675, 2.063063063063063, 1.2792792792792793, 1.2432432432432432, 1.3063063063063063]",[],"HizmetTurco is a political scientist based in Istanbul, Turkey, with a focus on the Hizmet Movement and dialogue initiatives. They are active on social media, engaging with a community of 1,109 followers and have made 30,496 posts. Although their account is not verified, they share insights related to their interests as a Turkish Muslim. HizmetTurco follows 463 accounts and has a collection of 4,262 favorites."
2,2484630409,lifegallery.co.uk,thelifegallery,"thelifegallery is a prolific Twitter user dedicated to curating the best compilations of Twitter pictures. With a substantial following of 514 and a network of 1994 friends, they actively engage with the platform, having posted nearly 10,000 tweets and favorited over 2,300 posts. Despite not being verified, their passion for sharing visual content shines through their extensive activity.",2014-05-08 21:38:48+0000,514,1994,[],[],[],[],"[1.4594594594594594, 1.2342342342342343, 1.4144144144144144, 1.2252252252252251, 1.3513513513513513, 1.3063063063063063, 0.4594594594594595, 0.36036036036036034, 0.35135135135135137, 0.36036036036036034, 0.3063063063063063, 0.5225225225225225, 1.0810810810810811, 1.4144144144144144, 1.5495495495495495, 2.135135135135135, 2.027027027027027, 2.0, 1.5585585585585586, 1.5675675675675675, 2.063063063063063, 1.2792792792792793, 1.2432432432432432, 1.3063063063063063]",[],"thelifegallery is a prolific Twitter user dedicated to curating the best compilations of Twitter pictures. With a substantial following of 514 and a network of 1994 friends, they actively engage with the platform, having posted nearly 10,000 tweets and favorited over 2,300 posts. Despite not being verified, their passion for sharing visual content shines through their extensive activity."
3,202568095,David Adanero,DavidAdanero,"DavidAdanero is a graphic designer based in the vibrant Le Marais district of Paris, France. Despite being of legal age and consenting, his website remains perpetually 'under construction' with a humorous promise to tackle it 'tomorrow.' With 567 friends and 174 followers, he actively engages on social media, posting a total of 1964 statuses and favoriting 77 posts. His account is currently not verified.",2010-10-14 10:13:47+0000,174,567,['868112707'],[],[],[],"[1.4594594594594594, 1.2342342342342343, 1.4144144144144144, 1.2252252252252251, 1.3513513513513513, 1.3063063063063063, 0.4594594594594595, 0.36036036036036034, 0.35135135135135137, 0.36036036036036034, 0.3063063063063063, 0.5225225225225225, 1.0810810810810811, 1.4144144144144144, 1.5495495495495495, 2.135135135135135, 2.027027027027027, 2.0, 1.5585585585585586, 1.5675675675675675, 2.063063063063063, 1.2792792792792793, 1.2432432432432432, 1.3063063063063063]",[],"DavidAdanero is a graphic designer based in the vibrant Le Marais district of Paris, France. Despite being of legal age and consenting, his website remains perpetually 'under construction' with a humorous promise to tackle it 'tomorrow.' With 567 friends and 174 followers, he actively engages on social media, posting a total of 1964 statuses and favoriting 77 posts. His account is currently not verified."
4,72588786,l4zick,L4zick,"L4zick is an active social media user who enjoys retweeting content and appreciates others who do the same. With a significant presence on the platform, they have amassed 1,979 friends and 932 followers. L4zick has posted a total of 68,182 statuses and has favorited 22,166 tweets. Although their account is not verified, they engage with the community from the World Wide Web.",2009-09-08 16:04:19+0000,932,1979,['868112707'],[],[],[],"[1.4594594594594594, 1.2342342342342343, 1.4144144144144144, 1.2252252252252251, 1.3513513513513513, 1.3063063063063063, 0.4594594594594595, 0.36036036036036034, 0.35135135135135137, 0.36036036036036034, 0.3063063063063063, 0.5225225225225225, 1.0810810810810811, 1.4144144144144144, 1.5495495495495495, 2.135135135135135, 2.027027027027027, 2.0, 1.5585585585585586, 1.5675675675675675, 2.063063063063063, 1.2792792792792793, 1.2432432432432432, 1.3063063063063063]",[],"L4zick is an active social media user who enjoys retweeting content and appreciates others who do the same. With a significant presence on the platform, they have amassed 1,979 friends and 932 followers. L4zick has posted a total of 68,182 statuses and has favorited 22,166 tweets. Although their account is not verified, they engage with the community from the World Wide Web."
5,1092729763,DV,dominicvasseur,"Dominic Vasseur is a social media user based in Marseille, France. Despite not having a verified account, they actively engage with their community, boasting 113 friends and 51 followers. With a total of 2,990 statuses posted and 4,649 favourites, Dominic shares a broad range of content and interests.",2013-01-15 17:23:28+0000,51,113,[],[],[],[],"[1.4594594594594594, 1.2342342342342343, 1.4144144144144144, 1.2252252252252251, 1.3513513513513513, 1.3063063063063063, 0.4594594594594595, 0.36036036036036034, 0.35135135135135137, 0.36036036036036034, 0.3063063063063063, 0.5225225225225225, 1.0810810810810811, 1.4144144144144144, 1.5495495495495495, 2.135135135135135, 2.027027027027027, 2.0, 1.5585585585585586, 1.5675675675675675, 2.063063063063063, 1.2792792792792793, 1.2432432432432432, 1.3063063063063063]",[],"Dominic Vasseur is a social media user based in Marseille, France. Despite not having a verified account, they actively engage with their community, boasting 113 friends and 51 followers. With a total of 2,990 statuses posted and 4,649 favourites, Dominic shares a broad range of content and interests."
6,1100855744,stephen han,stp_han,"User stp_han has a total of 452 statuses and 113 favorites. They have 115 friends but only 14 followers, indicating a more active engagement with their friends than a large follower base. Their account is not verified, and no location information is provided.",2013-01-18 12:32:26+0000,14,115,['18598424'],[],[],[],"[1.4594594594594594, 1.2342342342342343, 1.4144144144144144, 1.2252252252252251, 1.3513513513513513, 1.3063063063063063, 0.4594594594594595, 0.36036036036036034, 0.35135135135135137, 0.36036036036036034, 0.3063063063063063, 0.5225225225225225, 1.0810810810810811, 1.4144144144144144, 1.5495495495495495, 2.135135135135135, 2.027027027027027, 2.0, 1.5585585585585586, 1.5675675675675675, 2.063063063063063, 1.2792792792792793, 1.2432432432432432, 1.3063063063063063]",[],"User stp_han has a total of 452 statuses and 113 favorites. They have 115 friends but only 14 followers, indicating a more active engagement with their friends than a large follower base. Their account is not verified, and no location information is provided."
7,102579213,Christen Hill,babsmediabrissy,"Babsmediabrissy is an inquisitive former journalist and seasoned TV and web content producer based in Brisbane. With a strong background in media and communications, they reflect on their notable involvement in the #G20Brisbane event of 2014, while pondering future opportunities. They engage actively on social media, boasting a following of 479 and a network of 1068 friends, with a total of 821 statuses and 314 favorites.",2010-01-07 04:49:25+0000,479,1068,['868112707'],[],[],[],"[1.4594594594594594, 1.2342342342342343, 1.4144144144144144, 1.2252252252252251, 1.3513513513513513, 1.3063063063063063, 0.4594594594594595, 0.36036036036036034, 0.35135135135135137, 0.36036036036036034, 0.3063063063063063, 0.5225225225225225, 1.0810810810810811, 1.4144144144144144, 1.5495495495495495, 2.135135135135135, 2.027027027027027, 2.0, 1.5585585585585586, 1.5675675675675675, 2.063063063063063, 1.2792792792792793, 1.2432432432432432, 1.3063063063063063]",[],"Babsmediabrissy is an inquisitive former journalist and seasoned TV and web content producer based in Brisbane. With a strong background in media and communications, they reflect on their notable involvement in the #G20Brisbane event of 2014, while pondering future opportunities. They engage actively on social media, boasting a following of 479 and a network of 1068 friends, with a total of 821 statuses and 314 favorites."
8,526226529,Alexis Verger,Alexis_Verger,"Alexis Verger is a Molecular Biologist based in Lille, France, affiliated with the CNRS. With a focus on protein structure and function, Alexis specializes in transcription factors and their cofactors. They have a notable social media presence with 1,253 followers and have made 5,012 posts, showcasing their dedication to sharing knowledge and insights in their field. Although their account is not verified, they engage with a network of 969 friends and have accumulated 3,131 likes, reflecting an active participation in discussions related to molecular biology.",2012-03-16 09:50:32+0000,1253,969,[],[],[],[],"[1.4594594594594594, 1.2342342342342343, 1.4144144144144144, 1.2252252252252251, 1.3513513513513513, 1.3063063063063063, 0.4594594594594595, 0.36036036036036034, 0.35135135135135137, 0.36036036036036034, 0.3063063063063063, 0.5225225225225225, 1.0810810810810811, 1.4144144144144144, 1.5495495495495495, 2.135135135135135, 2.027027027027027, 2.0, 1.5585585585585586, 1.5675675675675675, 2.063063063063063, 1.2792792792792793, 1.2432432432432432, 1.3063063063063063]",[],"Alexis Verger is a Molecular Biologist based in Lille, France, affiliated with the CNRS. With a focus on protein structure and function, Alexis specializes in transcription factors and their cofactors. They have a notable social media presence with 1,253 followers and have made 5,012 posts, showcasing their dedication to sharing knowledge and insights in their field. Although their account is not verified, they engage with a network of 969 friends and have accumulated 3,131 likes, reflecting an active participation in discussions related to molecular biology."
