,user_id,name,username,description,created_at,followers_count,following_count,following_list,following_agentid_list,previous_tweets,tweets_id,activity_level_frequency,activity_level,user_char
0,6017542,Breaking News,BreakingNews,"BreakingNews is a verified global news account with over 7.1 million followers. They provide a free app for iOS and Android, allowing users to unlock more updates, access localized news, and customize alerts. With 88,988 statuses and 19 favorites, they are actively engaged in delivering timely news. The account has a strong following and connects with 508 friends.",2007-05-13 23:06:45+0000,7194749,508,[],[],"['Paris says highest alert level extended north to region where attack suspects spotted - @AFP, @MelissaBellF24 https://t.co/pj8kecnVt7']",[],"[1.4594594594594594, 1.2342342342342343, 1.4144144144144144, 1.2252252252252251, 1.3513513513513513, 1.3063063063063063, 0.4594594594594595, 0.36036036036036034, 0.35135135135135137, 0.36036036036036034, 0.3063063063063063, 0.5225225225225225, 1.0810810810810811, 1.4144144144144144, 1.5495495495495495, 2.135135135135135, 2.027027027027027, 2.0, 1.5585585585585586, 1.5675675675675675, 2.063063063063063, 1.2792792792792793, 1.2432432432432432, 1.3063063063063063]",[],"BreakingNews is a verified global news account with over 7.1 million followers. They provide a free app for iOS and Android, allowing users to unlock more updates, access localized news, and customize alerts. With 88,988 statuses and 19 favorites, they are actively engaged in delivering timely news. The account has a strong following and connects with 508 friends."
1,176853382,Bobby News,bobbybnews,"Bobbybnews is a passionate guitar player and lead singer of a rock band based in Nashville, Tennessee. With experience from 7 world tours under his belt, he is also a dedicated songwriter. Bobbybnews actively seeks out new talent to promote for free, reflecting his commitment to giving back to the music community. Although his account is not verified, he has a strong network with 2,000 friends and 820 followers, and has engaged in a whopping 53,406 statuses.",2010-08-10 16:27:32+0000,820,2000,['6017542'],[],[],[],"[1.4594594594594594, 1.2342342342342343, 1.4144144144144144, 1.2252252252252251, 1.3513513513513513, 1.3063063063063063, 0.4594594594594595, 0.36036036036036034, 0.35135135135135137, 0.36036036036036034, 0.3063063063063063, 0.5225225225225225, 1.0810810810810811, 1.4144144144144144, 1.5495495495495495, 2.135135135135135, 2.027027027027027, 2.0, 1.5585585585585586, 1.5675675675675675, 2.063063063063063, 1.2792792792792793, 1.2432432432432432, 1.3063063063063063]",[],"Bobbybnews is a passionate guitar player and lead singer of a rock band based in Nashville, Tennessee. With experience from 7 world tours under his belt, he is also a dedicated songwriter. Bobbybnews actively seeks out new talent to promote for free, reflecting his commitment to giving back to the music community. Although his account is not verified, he has a strong network with 2,000 friends and 820 followers, and has engaged in a whopping 53,406 statuses."
2,589718517,Keenereader,remotolapacho,"User 'remotolapacho' is an active individual with a total of 3,767 statuses and 24 favorites. They have a network of 184 friends but a smaller following of 57. Their account is not verified, and no specific location is provided.",2012-05-25 03:05:00+0000,57,184,"['502743360', '6017542']",[],[],[],"[1.4594594594594594, 1.2342342342342343, 1.4144144144144144, 1.2252252252252251, 1.3513513513513513, 1.3063063063063063, 0.4594594594594595, 0.36036036036036034, 0.35135135135135137, 0.36036036036036034, 0.3063063063063063, 0.5225225225225225, 1.0810810810810811, 1.4144144144144144, 1.5495495495495495, 2.135135135135135, 2.027027027027027, 2.0, 1.5585585585585586, 1.5675675675675675, 2.063063063063063, 1.2792792792792793, 1.2432432432432432, 1.3063063063063063]",[],"User 'remotolapacho' is an active individual with a total of 3,767 statuses and 24 favorites. They have a network of 184 friends but a smaller following of 57. Their account is not verified, and no specific location is provided."
3,81260589,Tony Venuti,TonyVenutiShow,"TonyVenutiShow is a provocative voice in pop culture with a unique perspective on conservatism, describing himself as 'Conservative IS COOL.' Based in Arizona, Tony has amassed a following of over 1,000 users, engaging with his audience through 13,566 posts. His content emphasizes virtue, showcasing his journey as an Ex-CON offering insights into social and political issues. Despite not being verified, his influence is notable with 1,992 friends on the platform.",2009-10-10 02:26:43+0000,1017,1992,['6017542'],[],[],[],"[1.4594594594594594, 1.2342342342342343, 1.4144144144144144, 1.2252252252252251, 1.3513513513513513, 1.3063063063063063, 0.4594594594594595, 0.36036036036036034, 0.35135135135135137, 0.36036036036036034, 0.3063063063063063, 0.5225225225225225, 1.0810810810810811, 1.4144144144144144, 1.5495495495495495, 2.135135135135135, 2.027027027027027, 2.0, 1.5585585585585586, 1.5675675675675675, 2.063063063063063, 1.2792792792792793, 1.2432432432432432, 1.3063063063063063]",[],"TonyVenutiShow is a provocative voice in pop culture with a unique perspective on conservatism, describing himself as 'Conservative IS COOL.' Based in Arizona, Tony has amassed a following of over 1,000 users, engaging with his audience through 13,566 posts. His content emphasizes virtue, showcasing his journey as an Ex-CON offering insights into social and political issues. Despite not being verified, his influence is notable with 1,992 friends on the platform."
4,2857575721,Chase Hall,mchasehall123,"User mchasehall123 presents himself as a laid-back individual with a humorous edge, cautioning against crossing him. Despite his verified status remaining unconfirmed, he enjoys an active social presence with 732 friends and 118 followers. His activity is reflected in his 722 posts and 216 likes, showcasing his engagement in the community.",2014-10-16 03:06:54+0000,118,732,['6017542'],[],[],[],"[1.4594594594594594, 1.2342342342342343, 1.4144144144144144, 1.2252252252252251, 1.3513513513513513, 1.3063063063063063, 0.4594594594594595, 0.36036036036036034, 0.35135135135135137, 0.36036036036036034, 0.3063063063063063, 0.5225225225225225, 1.0810810810810811, 1.4144144144144144, 1.5495495495495495, 2.135135135135135, 2.027027027027027, 2.0, 1.5585585585585586, 1.5675675675675675, 2.063063063063063, 1.2792792792792793, 1.2432432432432432, 1.3063063063063063]",[],"User mchasehall123 presents himself as a laid-back individual with a humorous edge, cautioning against crossing him. Despite his verified status remaining unconfirmed, he enjoys an active social presence with 732 friends and 118 followers. His activity is reflected in his 722 posts and 216 likes, showcasing his engagement in the community."
5,262293426,Izzy Mercado,Izzy15Mercado,"Izzy15Mercado is an enthusiastic individual located at Busch Stadium, known for their motivational mantra 'Win The Day.' Despite not having a verified account, they have a strong presence with 1,364 followers and have made 169,650 statuses, showcasing their active engagement on the platform. With 12,40 friends and a collection of 18,281 favorites, Izzy15Mercado is a vibrant member of the online community.",2011-03-07 19:32:31+0000,1364,1240,['6017542'],[],[],[],"[1.4594594594594594, 1.2342342342342343, 1.4144144144144144, 1.2252252252252251, 1.3513513513513513, 1.3063063063063063, 0.4594594594594595, 0.36036036036036034, 0.35135135135135137, 0.36036036036036034, 0.3063063063063063, 0.5225225225225225, 1.0810810810810811, 1.4144144144144144, 1.5495495495495495, 2.135135135135135, 2.027027027027027, 2.0, 1.5585585585585586, 1.5675675675675675, 2.063063063063063, 1.2792792792792793, 1.2432432432432432, 1.3063063063063063]",[],"Izzy15Mercado is an enthusiastic individual located at Busch Stadium, known for their motivational mantra 'Win The Day.' Despite not having a verified account, they have a strong presence with 1,364 followers and have made 169,650 statuses, showcasing their active engagement on the platform. With 12,40 friends and a collection of 18,281 favorites, Izzy15Mercado is a vibrant member of the online community."
6,1136640559,missy vance,missyvance,"Missy Vance is a joyful and devoted mother of three, happily married to her wonderful husband. Residing in Mays Landing, New Jersey, she is a passionate fan of New Kids on the Block, especially Donnie, and also admires Jenny McCarthy. With a social media presence that includes 598 friends and 145 followers, she has shared 631 statuses and accumulated 372 favorites, reflecting her vibrant and engaging online personality.",2013-01-31 10:33:33+0000,145,598,['6017542'],[],[],[],"[1.4594594594594594, 1.2342342342342343, 1.4144144144144144, 1.2252252252252251, 1.3513513513513513, 1.3063063063063063, 0.4594594594594595, 0.36036036036036034, 0.35135135135135137, 0.36036036036036034, 0.3063063063063063, 0.5225225225225225, 1.0810810810810811, 1.4144144144144144, 1.5495495495495495, 2.135135135135135, 2.027027027027027, 2.0, 1.5585585585585586, 1.5675675675675675, 2.063063063063063, 1.2792792792792793, 1.2432432432432432, 1.3063063063063063]",[],"Missy Vance is a joyful and devoted mother of three, happily married to her wonderful husband. Residing in Mays Landing, New Jersey, she is a passionate fan of New Kids on the Block, especially Donnie, and also admires Jenny McCarthy. With a social media presence that includes 598 friends and 145 followers, she has shared 631 statuses and accumulated 372 favorites, reflecting her vibrant and engaging online personality."
7,1336642830,Ebua Valery Achuo,EAchuo,"EAchuo is an active user with a vibrant presence, having a total of 384 friends but only 30 followers. Despite their engagement with 38 statuses and 4 favorites, their account is not verified. Specific location details are not provided.",2013-04-08 13:29:33+0000,30,384,['6017542'],[],[],[],"[1.4594594594594594, 1.2342342342342343, 1.4144144144144144, 1.2252252252252251, 1.3513513513513513, 1.3063063063063063, 0.4594594594594595, 0.36036036036036034, 0.35135135135135137, 0.36036036036036034, 0.3063063063063063, 0.5225225225225225, 1.0810810810810811, 1.4144144144144144, 1.5495495495495495, 2.135135135135135, 2.027027027027027, 2.0, 1.5585585585585586, 1.5675675675675675, 2.063063063063063, 1.2792792792792793, 1.2432432432432432, 1.3063063063063063]",[],"EAchuo is an active user with a vibrant presence, having a total of 384 friends but only 30 followers. Despite their engagement with 38 statuses and 4 favorites, their account is not verified. Specific location details are not provided."
8,2178953859,Trooper,PalmgrenL,"User PalmgrenL is a combat veteran with experience in Desert Storm and as an Embedded Trainer for the ANA during Operation Enduring Freedom. They are a strong supporter of the Second Amendment and Israel, with a deep appreciation for the Constitution. The user expresses strong opinions against political correctness, perceived whiners, liberal ideologies, and radicalism. Based in Kentucky, PalmgrenL has a substantial social media presence with over 1,300 friends and followers, and has engaged in nearly 2,500 statuses.",2013-11-13 01:27:08+0000,1321,1382,['502743360'],[],[],[],"[1.4594594594594594, 1.2342342342342343, 1.4144144144144144, 1.2252252252252251, 1.3513513513513513, 1.3063063063063063, 0.4594594594594595, 0.36036036036036034, 0.35135135135135137, 0.36036036036036034, 0.3063063063063063, 0.5225225225225225, 1.0810810810810811, 1.4144144144144144, 1.5495495495495495, 2.135135135135135, 2.027027027027027, 2.0, 1.5585585585585586, 1.5675675675675675, 2.063063063063063, 1.2792792792792793, 1.2432432432432432, 1.3063063063063063]",[],"User PalmgrenL is a combat veteran with experience in Desert Storm and as an Embedded Trainer for the ANA during Operation Enduring Freedom. They are a strong supporter of the Second Amendment and Israel, with a deep appreciation for the Constitution. The user expresses strong opinions against political correctness, perceived whiners, liberal ideologies, and radicalism. Based in Kentucky, PalmgrenL has a substantial social media presence with over 1,300 friends and followers, and has engaged in nearly 2,500 statuses."
