,user_id,name,username,description,created_at,followers_count,following_count,following_list,following_agentid_list,previous_tweets,tweets_id,activity_level_frequency,activity_level,user_char
0,346809444,jg,JustinGlawe,"Justin Glawe is a writer contributing to VICE and The Daily Beast, with a focus on topics such as Native child welfare on the Spirit Lake Reservation and crime in Peoria, which he explores in his projects. Based in Detroit (#PTROIT), he engages with a substantial audience on social media, boasting over 2,200 followers and a network of 1,000 friends. With a total of over 14,700 tweets and a significant number of favorites, he actively shares his insights and narratives.",2011-08-01 21:37:42+0000,2247,1013,['17986832'],[],['The other day I asked a manager at the #Ferguson Market if police had requested surveillance video. She said no.'],[],"[1.4594594594594594, 1.2342342342342343, 1.4144144144144144, 1.2252252252252251, 1.3513513513513513, 1.3063063063063063, 0.4594594594594595, 0.36036036036036034, 0.35135135135135137, 0.36036036036036034, 0.3063063063063063, 0.5225225225225225, 1.0810810810810811, 1.4144144144144144, 1.5495495495495495, 2.135135135135135, 2.027027027027027, 2.0, 1.5585585585585586, 1.5675675675675675, 2.063063063063063, 1.2792792792792793, 1.2432432432432432, 1.3063063063063063]",[],"Justin Glawe is a writer contributing to VICE and The Daily Beast, with a focus on topics such as Native child welfare on the Spirit Lake Reservation and crime in Peoria, which he explores in his projects. Based in Detroit (#PTROIT), he engages with a substantial audience on social media, boasting over 2,200 followers and a network of 1,000 friends. With a total of over 14,700 tweets and a significant number of favorites, he actively shares his insights and narratives."
1,45446985,jash,jashsf,"Jashsf is an enthusiastic user based in San Francisco, who passionately believes it is the greatest city on earth. With 3,760 friends and 3,621 followers, Jashsf maintains an active presence on the platform, having posted 215,199 updates and favorited 48,748 tweets. Their account is not verified.",2009-06-07 23:12:14+0000,3621,3760,['24134004'],[],[],[],"[1.4594594594594594, 1.2342342342342343, 1.4144144144144144, 1.2252252252252251, 1.3513513513513513, 1.3063063063063063, 0.4594594594594595, 0.36036036036036034, 0.35135135135135137, 0.36036036036036034, 0.3063063063063063, 0.5225225225225225, 1.0810810810810811, 1.4144144144144144, 1.5495495495495495, 2.135135135135135, 2.027027027027027, 2.0, 1.5585585585585586, 1.5675675675675675, 2.063063063063063, 1.2792792792792793, 1.2432432432432432, 1.3063063063063063]",[],"Jashsf is an enthusiastic user based in San Francisco, who passionately believes it is the greatest city on earth. With 3,760 friends and 3,621 followers, Jashsf maintains an active presence on the platform, having posted 215,199 updates and favorited 48,748 tweets. Their account is not verified."
2,1559556577,Jerinice Quiles,jerispringerr,"Jerispringerr is a social media user and a UCF graduate from the class of 2016. They have an active presence with 2,568 posts and 1,125 likes. Jerispringerr enjoys connecting with others, boasting 441 friends and 269 followers, although their account is not verified.",2013-07-01 03:31:15+0000,269,441,['373157754'],[],[],[],"[1.4594594594594594, 1.2342342342342343, 1.4144144144144144, 1.2252252252252251, 1.3513513513513513, 1.3063063063063063, 0.4594594594594595, 0.36036036036036034, 0.35135135135135137, 0.36036036036036034, 0.3063063063063063, 0.5225225225225225, 1.0810810810810811, 1.4144144144144144, 1.5495495495495495, 2.135135135135135, 2.027027027027027, 2.0, 1.5585585585585586, 1.5675675675675675, 2.063063063063063, 1.2792792792792793, 1.2432432432432432, 1.3063063063063063]",[],"Jerispringerr is a social media user and a UCF graduate from the class of 2016. They have an active presence with 2,568 posts and 1,125 likes. Jerispringerr enjoys connecting with others, boasting 441 friends and 269 followers, although their account is not verified."
3,533869428,mary molina,marymolina20,"Marymolina20 is a user with an unverified account, engaging actively with 39 posts and accumulating 7 favorites. Based on her small network, she has 8 friends and 3 followers. Further details about her location are not provided.",2012-03-23 02:39:44+0000,3,8,[],[],[],[],"[1.4594594594594594, 1.2342342342342343, 1.4144144144144144, 1.2252252252252251, 1.3513513513513513, 1.3063063063063063, 0.4594594594594595, 0.36036036036036034, 0.35135135135135137, 0.36036036036036034, 0.3063063063063063, 0.5225225225225225, 1.0810810810810811, 1.4144144144144144, 1.5495495495495495, 2.135135135135135, 2.027027027027027, 2.0, 1.5585585585585586, 1.5675675675675675, 2.063063063063063, 1.2792792792792793, 1.2432432432432432, 1.3063063063063063]",[],"Marymolina20 is a user with an unverified account, engaging actively with 39 posts and accumulating 7 favorites. Based on her small network, she has 8 friends and 3 followers. Further details about her location are not provided."
4,100085032,Yung Humma,SiDonTrip,"SiDonTrip is a humorous and optimistic individual from Atlanta, GA, who embraces the unpredictability of life with the motto 'My plans always work sometimes.' A proud husband and father, he is an alumnus of Hampton University and a member of ΦΒΣ. SiDonTrip is a passionate sports fan, cheering for the Braves, Falcons, Hawks, and Dawgz. With a strong social media presence, he has 840 friends and 509 followers, sharing his thoughts and experiences through over 54,000 statuses.",2009-12-29 00:15:47+0000,509,840,['20814385'],[],[],[],"[1.4594594594594594, 1.2342342342342343, 1.4144144144144144, 1.2252252252252251, 1.3513513513513513, 1.3063063063063063, 0.4594594594594595, 0.36036036036036034, 0.35135135135135137, 0.36036036036036034, 0.3063063063063063, 0.5225225225225225, 1.0810810810810811, 1.4144144144144144, 1.5495495495495495, 2.135135135135135, 2.027027027027027, 2.0, 1.5585585585585586, 1.5675675675675675, 2.063063063063063, 1.2792792792792793, 1.2432432432432432, 1.3063063063063063]",[],"SiDonTrip is a humorous and optimistic individual from Atlanta, GA, who embraces the unpredictability of life with the motto 'My plans always work sometimes.' A proud husband and father, he is an alumnus of Hampton University and a member of ΦΒΣ. SiDonTrip is a passionate sports fan, cheering for the Braves, Falcons, Hawks, and Dawgz. With a strong social media presence, he has 840 friends and 509 followers, sharing his thoughts and experiences through over 54,000 statuses."
5,21274637,Dick  Schwanz,GeekNStereo,"GeekNStereo is an active social media user based in St. Louis (#STL), with a vibrant online presence reflected in their 155,326 statuses and 2,621 favorites. They have a strong following of 3,308 and maintain a network of 2,113 friends. Their bio, 'Everywhere I Choose 2 Be...', suggests a free-spirited and adventurous personality. Although their account is not verified, they engage with the #STL4Unity community, showcasing their commitment to local connections.",2009-02-19 04:10:42+0000,3308,2113,[],[],[],[],"[1.4594594594594594, 1.2342342342342343, 1.4144144144144144, 1.2252252252252251, 1.3513513513513513, 1.3063063063063063, 0.4594594594594595, 0.36036036036036034, 0.35135135135135137, 0.36036036036036034, 0.3063063063063063, 0.5225225225225225, 1.0810810810810811, 1.4144144144144144, 1.5495495495495495, 2.135135135135135, 2.027027027027027, 2.0, 1.5585585585585586, 1.5675675675675675, 2.063063063063063, 1.2792792792792793, 1.2432432432432432, 1.3063063063063063]",[],"GeekNStereo is an active social media user based in St. Louis (#STL), with a vibrant online presence reflected in their 155,326 statuses and 2,621 favorites. They have a strong following of 3,308 and maintain a network of 2,113 friends. Their bio, 'Everywhere I Choose 2 Be...', suggests a free-spirited and adventurous personality. Although their account is not verified, they engage with the #STL4Unity community, showcasing their commitment to local connections."
