,user_id,name,username,description,created_at,followers_count,following_count,following_list,following_agentid_list,previous_tweets,tweets_id,activity_level_frequency,activity_level,user_char
0,1020058453,BuzzFeed News,BuzzFeedNews,"BuzzFeedNews is a verified news outlet focused on delivering breaking news for the social web. Run by a dedicated team including @AustinHunt, @sts10, and @weeddude, it has garnered a substantial following with over 262,000 followers. The account is highly active, with nearly 44,000 tweets and a diverse range of interests, evident from its 331 favorites. With a network of 4,762 friends, BuzzFeedNews stays connected with various voices in the media landscape.",2012-12-18 15:46:37+0000,262423,4762,[],[],['Report: Co-Pilot Locked Out Of Cockpit Before Fatal Plane Crash http://t.co/aXGQuacv2E #Germanwings http://t.co/T80L7BhXX6'],[],"[1.4594594594594594, 1.2342342342342343, 1.4144144144144144, 1.2252252252252251, 1.3513513513513513, 1.3063063063063063, 0.4594594594594595, 0.36036036036036034, 0.35135135135135137, 0.36036036036036034, 0.3063063063063063, 0.5225225225225225, 1.0810810810810811, 1.4144144144144144, 1.5495495495495495, 2.135135135135135, 2.027027027027027, 2.0, 1.5585585585585586, 1.5675675675675675, 2.063063063063063, 1.2792792792792793, 1.2432432432432432, 1.3063063063063063]",[],"BuzzFeedNews is a verified news outlet focused on delivering breaking news for the social web. Run by a dedicated team including @AustinHunt, @sts10, and @weeddude, it has garnered a substantial following with over 262,000 followers. The account is highly active, with nearly 44,000 tweets and a diverse range of interests, evident from its 331 favorites. With a network of 4,762 friends, BuzzFeedNews stays connected with various voices in the media landscape."
1,14386498,Barry Hayes,BarryHayes,"BarryHayes is an active social media user based in Ottawa, Ontario, Canada. With a total of 2,370 statuses shared, he showcases a lively engagement online despite his account not being verified. Barry has a network of 331 friends and 366 followers, and he often expresses his interests with 184 favorites. He humorously reflects that he 'peaked in 2006,' indicating a nostalgic sentiment about that time in his life.",2008-04-14 15:38:13+0000,366,331,['1020058453'],[],[],[],"[1.4594594594594594, 1.2342342342342343, 1.4144144144144144, 1.2252252252252251, 1.3513513513513513, 1.3063063063063063, 0.4594594594594595, 0.36036036036036034, 0.35135135135135137, 0.36036036036036034, 0.3063063063063063, 0.5225225225225225, 1.0810810810810811, 1.4144144144144144, 1.5495495495495495, 2.135135135135135, 2.027027027027027, 2.0, 1.5585585585585586, 1.5675675675675675, 2.063063063063063, 1.2792792792792793, 1.2432432432432432, 1.3063063063063063]",[],"BarryHayes is an active social media user based in Ottawa, Ontario, Canada. With a total of 2,370 statuses shared, he showcases a lively engagement online despite his account not being verified. Barry has a network of 331 friends and 366 followers, and he often expresses his interests with 184 favorites. He humorously reflects that he 'peaked in 2006,' indicating a nostalgic sentiment about that time in his life."
2,17971617,rshak8,rshak8,"User rshak8 is an active individual on social media with a total of 1,919 posts. They have 56 friends and 7 followers, indicating a relatively close-knit network. Their account is not verified, and they have engaged with content they enjoy, as shown by their 22 likes. However, their location is not provided.",2008-12-08 20:04:00+0000,7,56,['1020058453'],[],[],[],"[1.4594594594594594, 1.2342342342342343, 1.4144144144144144, 1.2252252252252251, 1.3513513513513513, 1.3063063063063063, 0.4594594594594595, 0.36036036036036034, 0.35135135135135137, 0.36036036036036034, 0.3063063063063063, 0.5225225225225225, 1.0810810810810811, 1.4144144144144144, 1.5495495495495495, 2.135135135135135, 2.027027027027027, 2.0, 1.5585585585585586, 1.5675675675675675, 2.063063063063063, 1.2792792792792793, 1.2432432432432432, 1.3063063063063063]",[],"User rshak8 is an active individual on social media with a total of 1,919 posts. They have 56 friends and 7 followers, indicating a relatively close-knit network. Their account is not verified, and they have engaged with content they enjoy, as shown by their 22 likes. However, their location is not provided."
3,2545900439,Douglas Nilsson,Douglas_Nilsson,"Douglas Nilsson is an air quality and climate researcher who is deeply passionate about social issues, identifying as a green social democrat, anti-fascist, and feminist. He balances his professional life with personal commitments as a husband and father, and enjoys photography in his spare time. Known for his distinctive style as an 'old man in a hat,' Douglas is an active social media user with over 19,000 posts, engaging with a community of 2,001 friends and 527 followers.",2014-05-13 22:28:48+0000,527,2001,[],[],[],[],"[1.4594594594594594, 1.2342342342342343, 1.4144144144144144, 1.2252252252252251, 1.3513513513513513, 1.3063063063063063, 0.4594594594594595, 0.36036036036036034, 0.35135135135135137, 0.36036036036036034, 0.3063063063063063, 0.5225225225225225, 1.0810810810810811, 1.4144144144144144, 1.5495495495495495, 2.135135135135135, 2.027027027027027, 2.0, 1.5585585585585586, 1.5675675675675675, 2.063063063063063, 1.2792792792792793, 1.2432432432432432, 1.3063063063063063]",[],"Douglas Nilsson is an air quality and climate researcher who is deeply passionate about social issues, identifying as a green social democrat, anti-fascist, and feminist. He balances his professional life with personal commitments as a husband and father, and enjoys photography in his spare time. Known for his distinctive style as an 'old man in a hat,' Douglas is an active social media user with over 19,000 posts, engaging with a community of 2,001 friends and 527 followers."
4,15224425,Maidhcí ,maidhci,"Maidhci is a TV Director and Producer at Nemeton TV, known for their energetic involvement in live sports events. Based in Corcaigh, they are an active social media user with over 5,200 posts and a substantial following of 1,028 individuals. Their profile reflects a passion for sports and broadcasting, though they have not yet achieved verified status.",2008-06-24 21:50:31+0000,1028,1403,['1020058453'],[],[],[],"[1.4594594594594594, 1.2342342342342343, 1.4144144144144144, 1.2252252252252251, 1.3513513513513513, 1.3063063063063063, 0.4594594594594595, 0.36036036036036034, 0.35135135135135137, 0.36036036036036034, 0.3063063063063063, 0.5225225225225225, 1.0810810810810811, 1.4144144144144144, 1.5495495495495495, 2.135135135135135, 2.027027027027027, 2.0, 1.5585585585585586, 1.5675675675675675, 2.063063063063063, 1.2792792792792793, 1.2432432432432432, 1.3063063063063063]",[],"Maidhci is a TV Director and Producer at Nemeton TV, known for their energetic involvement in live sports events. Based in Corcaigh, they are an active social media user with over 5,200 posts and a substantial following of 1,028 individuals. Their profile reflects a passion for sports and broadcasting, though they have not yet achieved verified status."
5,632640024,JoAnn Sanders,AutismMama06,"AutismMama06 is a dedicated stay-at-home wife and mother based in Tulsa, Oklahoma. She is passionate about raising awareness for autism, particularly as a parent to her 8-year-old non-verbal child with severe autism. With a conservative viewpoint, she actively engages with her community, sharing insights and experiences related to autism. Her account has a following of 115 and she has made 479 posts, reflecting her commitment to advocacy and support.",2012-07-11 03:56:53+0000,115,263,['1020058453'],[],[],[],"[1.4594594594594594, 1.2342342342342343, 1.4144144144144144, 1.2252252252252251, 1.3513513513513513, 1.3063063063063063, 0.4594594594594595, 0.36036036036036034, 0.35135135135135137, 0.36036036036036034, 0.3063063063063063, 0.5225225225225225, 1.0810810810810811, 1.4144144144144144, 1.5495495495495495, 2.135135135135135, 2.027027027027027, 2.0, 1.5585585585585586, 1.5675675675675675, 2.063063063063063, 1.2792792792792793, 1.2432432432432432, 1.3063063063063063]",[],"AutismMama06 is a dedicated stay-at-home wife and mother based in Tulsa, Oklahoma. She is passionate about raising awareness for autism, particularly as a parent to her 8-year-old non-verbal child with severe autism. With a conservative viewpoint, she actively engages with her community, sharing insights and experiences related to autism. Her account has a following of 115 and she has made 479 posts, reflecting her commitment to advocacy and support."
