,user_id,name,username,description,created_at,followers_count,following_count,following_list,following_agentid_list,previous_tweets,tweets_id,activity_level_frequency,activity_level,user_char
0,15012486,CBS News,CBSNews,"CBSNews is the official Twitter feed of CBS News, based in New York, NY. With a verified status, it provides original reporting and trusted news to its 3,366,613 followers. The account has posted 67,443 updates and has 396 friends, showcasing a commitment to delivering timely and reliable information.",2008-06-05 00:54:31+0000,3366613,396,['15032862'],[],['MORE: Police believe three gunmen were involved in shootings in Ottawa this morning and are looking for two shooters. http://t.co/IHV4galEtC'],[],"[1.4594594594594594, 1.2342342342342343, 1.4144144144144144, 1.2252252252252251, 1.3513513513513513, 1.3063063063063063, 0.4594594594594595, 0.36036036036036034, 0.35135135135135137, 0.36036036036036034, 0.3063063063063063, 0.5225225225225225, 1.0810810810810811, 1.4144144144144144, 1.5495495495495495, 2.135135135135135, 2.027027027027027, 2.0, 1.5585585585585586, 1.5675675675675675, 2.063063063063063, 1.2792792792792793, 1.2432432432432432, 1.3063063063063063]",[],"CBSNews is the official Twitter feed of CBS News, based in New York, NY. With a verified status, it provides original reporting and trusted news to its 3,366,613 followers. The account has posted 67,443 updates and has 396 friends, showcasing a commitment to delivering timely and reliable information."
1,2434406185,AEJ Khalil,AEJkhalil,"AEJkhalil is an active social media user with a focus on political and social issues, particularly regarding ISIS, Palestine, and the Kurdish struggle. They express strong opinions against extremist groups and advocate for the rights of oppressed communities. With 1,653 statuses and a following of 71, AEJkhalil engages with a modest network of 81 friends, although their account is not verified.",2014-04-08 21:37:11+0000,71,81,[],[],[],[],"[1.4594594594594594, 1.2342342342342343, 1.4144144144144144, 1.2252252252252251, 1.3513513513513513, 1.3063063063063063, 0.4594594594594595, 0.36036036036036034, 0.35135135135135137, 0.36036036036036034, 0.3063063063063063, 0.5225225225225225, 1.0810810810810811, 1.4144144144144144, 1.5495495495495495, 2.135135135135135, 2.027027027027027, 2.0, 1.5585585585585586, 1.5675675675675675, 2.063063063063063, 1.2792792792792793, 1.2432432432432432, 1.3063063063063063]",[],"AEJkhalil is an active social media user with a focus on political and social issues, particularly regarding ISIS, Palestine, and the Kurdish struggle. They express strong opinions against extremist groups and advocate for the rights of oppressed communities. With 1,653 statuses and a following of 71, AEJkhalil engages with a modest network of 81 friends, although their account is not verified."
2,167365470,Dana B,common_st,"common_st is a tech-savvy individual hailing from Cambridge, ON, Canada, with a passion for social history and English literature. They embrace a locavore lifestyle, showing a preference for locally-sourced food and products. With a sizable network of 335 friends and 477 followers, common_st actively engages on social media, boasting an impressive total of 44,123 statuses and 20 favourites. Currently, their account is not verified.",2010-07-16 11:54:24+0000,477,335,[],[],[],[],"[1.4594594594594594, 1.2342342342342343, 1.4144144144144144, 1.2252252252252251, 1.3513513513513513, 1.3063063063063063, 0.4594594594594595, 0.36036036036036034, 0.35135135135135137, 0.36036036036036034, 0.3063063063063063, 0.5225225225225225, 1.0810810810810811, 1.4144144144144144, 1.5495495495495495, 2.135135135135135, 2.027027027027027, 2.0, 1.5585585585585586, 1.5675675675675675, 2.063063063063063, 1.2792792792792793, 1.2432432432432432, 1.3063063063063063]",[],"common_st is a tech-savvy individual hailing from Cambridge, ON, Canada, with a passion for social history and English literature. They embrace a locavore lifestyle, showing a preference for locally-sourced food and products. With a sizable network of 335 friends and 477 followers, common_st actively engages on social media, boasting an impressive total of 44,123 statuses and 20 favourites. Currently, their account is not verified."
3,583137547,Daniel ,MTLDaniel,"MTLDaniel is a 40-year-old photographer residing in Montreal, Canada. Passionate about geek culture, nerd interests, and politics, he often shares his personal opinions through his tweets. Proud of his Armenian heritage, he also speaks French. With a follower count of 272 and 492 friends, he is an active Twitter user with 14,298 statuses and 1,146 favorites.",2012-05-17 21:00:48+0000,272,492,['15012486'],[],[],[],"[1.4594594594594594, 1.2342342342342343, 1.4144144144144144, 1.2252252252252251, 1.3513513513513513, 1.3063063063063063, 0.4594594594594595, 0.36036036036036034, 0.35135135135135137, 0.36036036036036034, 0.3063063063063063, 0.5225225225225225, 1.0810810810810811, 1.4144144144144144, 1.5495495495495495, 2.135135135135135, 2.027027027027027, 2.0, 1.5585585585585586, 1.5675675675675675, 2.063063063063063, 1.2792792792792793, 1.2432432432432432, 1.3063063063063063]",[],"MTLDaniel is a 40-year-old photographer residing in Montreal, Canada. Passionate about geek culture, nerd interests, and politics, he often shares his personal opinions through his tweets. Proud of his Armenian heritage, he also speaks French. With a follower count of 272 and 492 friends, he is an active Twitter user with 14,298 statuses and 1,146 favorites."
4,2298094741,Tyler ,Tyler2go,"Tyler2go is an active user with a whimsical online presence, engaging with a moderately sized community of 100 friends and 125 followers. With a substantial total of 4034 statuses, Tyler shares insights and updates that resonate with their audience. Despite having a modest number of favorites (61), the account is not verified, indicating Tyler is still on the journey to recognition in their digital landscape.",2014-01-18 15:43:27+0000,125,100,[],[],[],[],"[1.4594594594594594, 1.2342342342342343, 1.4144144144144144, 1.2252252252252251, 1.3513513513513513, 1.3063063063063063, 0.4594594594594595, 0.36036036036036034, 0.35135135135135137, 0.36036036036036034, 0.3063063063063063, 0.5225225225225225, 1.0810810810810811, 1.4144144144144144, 1.5495495495495495, 2.135135135135135, 2.027027027027027, 2.0, 1.5585585585585586, 1.5675675675675675, 2.063063063063063, 1.2792792792792793, 1.2432432432432432, 1.3063063063063063]",[],"Tyler2go is an active user with a whimsical online presence, engaging with a moderately sized community of 100 friends and 125 followers. With a substantial total of 4034 statuses, Tyler shares insights and updates that resonate with their audience. Despite having a modest number of favorites (61), the account is not verified, indicating Tyler is still on the journey to recognition in their digital landscape."
5,764143424,Scott Prater,HotTubScotty,"HotTubScotty is a lively personality from Venice, FL, known for his love of bacon and fishing. With a playful spirit as an unapologetic troublemaker, he engages with a community of 261 friends and has garnered 79 followers. Despite not having a verified account, he actively shares his thoughts with 459 statuses and has a collection of 129 favorites.",2012-08-17 17:45:33+0000,79,261,['15012486'],[],[],[],"[1.4594594594594594, 1.2342342342342343, 1.4144144144144144, 1.2252252252252251, 1.3513513513513513, 1.3063063063063063, 0.4594594594594595, 0.36036036036036034, 0.35135135135135137, 0.36036036036036034, 0.3063063063063063, 0.5225225225225225, 1.0810810810810811, 1.4144144144144144, 1.5495495495495495, 2.135135135135135, 2.027027027027027, 2.0, 1.5585585585585586, 1.5675675675675675, 2.063063063063063, 1.2792792792792793, 1.2432432432432432, 1.3063063063063063]",[],"HotTubScotty is a lively personality from Venice, FL, known for his love of bacon and fishing. With a playful spirit as an unapologetic troublemaker, he engages with a community of 261 friends and has garnered 79 followers. Despite not having a verified account, he actively shares his thoughts with 459 statuses and has a collection of 129 favorites."
6,231559189,Tim,Tallbadge,"Tallbadge is a 53-year-old Michigan resident with a passion for Detroit sports teams and a love for traveling. Having worn the Badge for 24 years, they have a deep appreciation for science and proudly embrace their Irish roots. Known for their playful nature, Tallbadge can't resist making friends with every dog they encounter. Despite not having a verified account, they have a vibrant social presence with 1,808 friends and 284 followers, having posted 6,905 updates and favorited 17 posts.",2010-12-28 21:33:02+0000,284,1808,['15012486'],[],[],[],"[1.4594594594594594, 1.2342342342342343, 1.4144144144144144, 1.2252252252252251, 1.3513513513513513, 1.3063063063063063, 0.4594594594594595, 0.36036036036036034, 0.35135135135135137, 0.36036036036036034, 0.3063063063063063, 0.5225225225225225, 1.0810810810810811, 1.4144144144144144, 1.5495495495495495, 2.135135135135135, 2.027027027027027, 2.0, 1.5585585585585586, 1.5675675675675675, 2.063063063063063, 1.2792792792792793, 1.2432432432432432, 1.3063063063063063]",[],"Tallbadge is a 53-year-old Michigan resident with a passion for Detroit sports teams and a love for traveling. Having worn the Badge for 24 years, they have a deep appreciation for science and proudly embrace their Irish roots. Known for their playful nature, Tallbadge can't resist making friends with every dog they encounter. Despite not having a verified account, they have a vibrant social presence with 1,808 friends and 284 followers, having posted 6,905 updates and favorited 17 posts."
7,35889865,Mathew McKinnon,MathewMcKinnon,"MathewMcKinnon is a Montreal-based researcher and producer specializing in television and radio at ICI Radio-Canada, where he contributes to Les Francs-Tireurs. With previous experience working with Paul Arcand and serving as a content supervisor for Salut Bonjour, he brings a wealth of expertise to the media industry. He is an active social media user with a follower count of 6,651 and has made 337 posts, showcasing his engagement with the online community despite his account not being verified.",2009-04-27 22:42:14+0000,6651,2088,[],[],[],[],"[1.4594594594594594, 1.2342342342342343, 1.4144144144144144, 1.2252252252252251, 1.3513513513513513, 1.3063063063063063, 0.4594594594594595, 0.36036036036036034, 0.35135135135135137, 0.36036036036036034, 0.3063063063063063, 0.5225225225225225, 1.0810810810810811, 1.4144144144144144, 1.5495495495495495, 2.135135135135135, 2.027027027027027, 2.0, 1.5585585585585586, 1.5675675675675675, 2.063063063063063, 1.2792792792792793, 1.2432432432432432, 1.3063063063063063]",[],"MathewMcKinnon is a Montreal-based researcher and producer specializing in television and radio at ICI Radio-Canada, where he contributes to Les Francs-Tireurs. With previous experience working with Paul Arcand and serving as a content supervisor for Salut Bonjour, he brings a wealth of expertise to the media industry. He is an active social media user with a follower count of 6,651 and has made 337 posts, showcasing his engagement with the online community despite his account not being verified."
8,2768705528,Pierre D'Armancour,pdarmancour,"User pdarmancour has chosen a French name for their Twitter account, using it as a tool to highlight and expose the prejudices of their opponents. With a following of 81 and 267 friends, they are an active participant in discussions, having posted 4,675 tweets and accumulated 311 likes. Their account is not verified.",2014-08-26 01:21:57+0000,81,267,['15012486'],[],[],[],"[1.4594594594594594, 1.2342342342342343, 1.4144144144144144, 1.2252252252252251, 1.3513513513513513, 1.3063063063063063, 0.4594594594594595, 0.36036036036036034, 0.35135135135135137, 0.36036036036036034, 0.3063063063063063, 0.5225225225225225, 1.0810810810810811, 1.4144144144144144, 1.5495495495495495, 2.135135135135135, 2.027027027027027, 2.0, 1.5585585585585586, 1.5675675675675675, 2.063063063063063, 1.2792792792792793, 1.2432432432432432, 1.3063063063063063]",[],"User pdarmancour has chosen a French name for their Twitter account, using it as a tool to highlight and expose the prejudices of their opponents. With a following of 81 and 267 friends, they are an active participant in discussions, having posted 4,675 tweets and accumulated 311 likes. Their account is not verified."
