,user_id,name,username,description,created_at,followers_count,following_count,following_list,following_agentid_list,previous_tweets,tweets_id,activity_level_frequency,activity_level,user_char
0,5402612,BBC Breaking News,BBCBreaking,"BBCBreaking is a verified Twitter account based in London, UK, dedicated to delivering breaking news alerts and updates from the BBC. With a substantial following of over 11.8 million followers, the account focuses on real-time news updates, encouraging users to follow @BBCWorld for international news, @BBCNews for UK news, and @BBCSport for the latest in sports. The account has posted a total of 21,529 tweets, maintaining an active presence with no listed favorites.",2007-04-22 14:42:37+0000,11834319,3,['742143'],[],"['Police say shots fired at 3 #Ottawa sites -  National War Memorial, Parliament Hill, and now Rideau shopping centre http://t.co/rOnqpUbuqc']",[],"[1.4594594594594594, 1.2342342342342343, 1.4144144144144144, 1.2252252252252251, 1.3513513513513513, 1.3063063063063063, 0.4594594594594595, 0.36036036036036034, 0.35135135135135137, 0.36036036036036034, 0.3063063063063063, 0.5225225225225225, 1.0810810810810811, 1.4144144144144144, 1.5495495495495495, 2.135135135135135, 2.027027027027027, 2.0, 1.5585585585585586, 1.5675675675675675, 2.063063063063063, 1.2792792792792793, 1.2432432432432432, 1.3063063063063063]",[],"BBCBreaking is a verified Twitter account based in London, UK, dedicated to delivering breaking news alerts and updates from the BBC. With a substantial following of over 11.8 million followers, the account focuses on real-time news updates, encouraging users to follow @BBCWorld for international news, @BBCNews for UK news, and @BBCSport for the latest in sports. The account has posted a total of 21,529 tweets, maintaining an active presence with no listed favorites."
1,2734300973,"Nduna, US citizen",Nduna_lux,"Nduna_lux is a user based in the USA who expresses a strong viewpoint on the complexities of terrorism and its implications. With a total of 809 statuses, they engage actively on the platform, though their account is not verified. They have a modest following of 21 and maintain 35 friends, indicating a small but potentially close-knit social network. Their bio suggests a critical perspective on societal issues.",2014-08-05 17:28:03+0000,21,35,[],[],[],[],"[1.4594594594594594, 1.2342342342342343, 1.4144144144144144, 1.2252252252252251, 1.3513513513513513, 1.3063063063063063, 0.4594594594594595, 0.36036036036036034, 0.35135135135135137, 0.36036036036036034, 0.3063063063063063, 0.5225225225225225, 1.0810810810810811, 1.4144144144144144, 1.5495495495495495, 2.135135135135135, 2.027027027027027, 2.0, 1.5585585585585586, 1.5675675675675675, 2.063063063063063, 1.2792792792792793, 1.2432432432432432, 1.3063063063063063]",[],"Nduna_lux is a user based in the USA who expresses a strong viewpoint on the complexities of terrorism and its implications. With a total of 809 statuses, they engage actively on the platform, though their account is not verified. They have a modest following of 21 and maintain 35 friends, indicating a small but potentially close-knit social network. Their bio suggests a critical perspective on societal issues."
2,488954078,Scott A Paro,SAParo2,"SAParo2 is a food enthusiast from Lake Cowichan, BC, who expresses a deep passion for all things culinary, as reflected in their bio 'Food Food Glorious Food - Thats me!'. While their account is not verified, they maintain an active presence with 243 statuses and have garnered a following of 90. SAParo2 has 262 friends, indicating a strong social connection within the platform, and they enjoy sharing their favorite content as seen in the 35 favourites they have collected.",2012-02-11 01:16:44+0000,90,262,['5402612'],[],[],[],"[1.4594594594594594, 1.2342342342342343, 1.4144144144144144, 1.2252252252252251, 1.3513513513513513, 1.3063063063063063, 0.4594594594594595, 0.36036036036036034, 0.35135135135135137, 0.36036036036036034, 0.3063063063063063, 0.5225225225225225, 1.0810810810810811, 1.4144144144144144, 1.5495495495495495, 2.135135135135135, 2.027027027027027, 2.0, 1.5585585585585586, 1.5675675675675675, 2.063063063063063, 1.2792792792792793, 1.2432432432432432, 1.3063063063063063]",[],"SAParo2 is a food enthusiast from Lake Cowichan, BC, who expresses a deep passion for all things culinary, as reflected in their bio 'Food Food Glorious Food - Thats me!'. While their account is not verified, they maintain an active presence with 243 statuses and have garnered a following of 90. SAParo2 has 262 friends, indicating a strong social connection within the platform, and they enjoy sharing their favorite content as seen in the 35 favourites they have collected."
3,1694019936,MystiRoz,MystiRoz,"MystiRoz from India embraces authenticity with a hint of subtlety, as reflected in their bio 'tel the truth; tel it slantly.' Despite not having a verified account, they have built a considerable social network with 213 friends and 77 followers. They actively engage with their community, boasting 1,478 statuses and a collection of 420 favorites.",2013-08-23 14:55:00+0000,77,213,"['409941587', '742143']",[],[],[],"[1.4594594594594594, 1.2342342342342343, 1.4144144144144144, 1.2252252252252251, 1.3513513513513513, 1.3063063063063063, 0.4594594594594595, 0.36036036036036034, 0.35135135135135137, 0.36036036036036034, 0.3063063063063063, 0.5225225225225225, 1.0810810810810811, 1.4144144144144144, 1.5495495495495495, 2.135135135135135, 2.027027027027027, 2.0, 1.5585585585585586, 1.5675675675675675, 2.063063063063063, 1.2792792792792793, 1.2432432432432432, 1.3063063063063063]",[],"MystiRoz from India embraces authenticity with a hint of subtlety, as reflected in their bio 'tel the truth; tel it slantly.' Despite not having a verified account, they have built a considerable social network with 213 friends and 77 followers. They actively engage with their community, boasting 1,478 statuses and a collection of 420 favorites."
4,77357640,Raymondillo,raymondillo,"Raymondillo is a cheerful and supportive individual who enjoys spreading positivity and helping others find smiles. With a wealth of experience and a humorous outlook on life, he embraces the journey of growing older while sharing joy with his 1,247 followers. Although not currently verified, he actively engages with a community of 1,190 friends through 22,711 statuses and 865 favorite posts.",2009-09-26 01:03:25+0000,1247,1190,"['309937712', '95524062', '5402612']",[],[],[],"[1.4594594594594594, 1.2342342342342343, 1.4144144144144144, 1.2252252252252251, 1.3513513513513513, 1.3063063063063063, 0.4594594594594595, 0.36036036036036034, 0.35135135135135137, 0.36036036036036034, 0.3063063063063063, 0.5225225225225225, 1.0810810810810811, 1.4144144144144144, 1.5495495495495495, 2.135135135135135, 2.027027027027027, 2.0, 1.5585585585585586, 1.5675675675675675, 2.063063063063063, 1.2792792792792793, 1.2432432432432432, 1.3063063063063063]",[],"Raymondillo is a cheerful and supportive individual who enjoys spreading positivity and helping others find smiles. With a wealth of experience and a humorous outlook on life, he embraces the journey of growing older while sharing joy with his 1,247 followers. Although not currently verified, he actively engages with a community of 1,190 friends through 22,711 statuses and 865 favorite posts."
5,557273215,zi,Zi_ladyrose,"Zi_ladyrose is a dedicated parent who finds joy and purpose in raising her children, believing that they elevate her to new heights. With a robust social media presence, she has amassed 438 friends and 477 followers, and actively shares her thoughts and experiences with 31,960 statuses and 15,491 likes. Though her account is not verified, her engaging content resonates with a supportive community.",2012-04-18 22:23:05+0000,477,438,"['742143', '5402612']",[],[],[],"[1.4594594594594594, 1.2342342342342343, 1.4144144144144144, 1.2252252252252251, 1.3513513513513513, 1.3063063063063063, 0.4594594594594595, 0.36036036036036034, 0.35135135135135137, 0.36036036036036034, 0.3063063063063063, 0.5225225225225225, 1.0810810810810811, 1.4144144144144144, 1.5495495495495495, 2.135135135135135, 2.027027027027027, 2.0, 1.5585585585585586, 1.5675675675675675, 2.063063063063063, 1.2792792792792793, 1.2432432432432432, 1.3063063063063063]",[],"Zi_ladyrose is a dedicated parent who finds joy and purpose in raising her children, believing that they elevate her to new heights. With a robust social media presence, she has amassed 438 friends and 477 followers, and actively shares her thoughts and experiences with 31,960 statuses and 15,491 likes. Though her account is not verified, her engaging content resonates with a supportive community."
6,176809173,Sammy Wilkinson,Slinkyone73,"Slinkyone73 is an active user located in Dewsbury, West Yorkshire, who has a total of 231 statuses and has garnered 15 followers. Despite having 30 friends, their account is not verified. They have shown a particular interest in 3 favorite posts.",2010-08-10 14:05:24+0000,15,30,['5402612'],[],[],[],"[1.4594594594594594, 1.2342342342342343, 1.4144144144144144, 1.2252252252252251, 1.3513513513513513, 1.3063063063063063, 0.4594594594594595, 0.36036036036036034, 0.35135135135135137, 0.36036036036036034, 0.3063063063063063, 0.5225225225225225, 1.0810810810810811, 1.4144144144144144, 1.5495495495495495, 2.135135135135135, 2.027027027027027, 2.0, 1.5585585585585586, 1.5675675675675675, 2.063063063063063, 1.2792792792792793, 1.2432432432432432, 1.3063063063063063]",[],"Slinkyone73 is an active user located in Dewsbury, West Yorkshire, who has a total of 231 statuses and has garnered 15 followers. Despite having 30 friends, their account is not verified. They have shown a particular interest in 3 favorite posts."
7,95524062,Darke Conteur,Darke_Conteur,"Darke_Conteur is a prolific author based in Kingston, Canada, specializing in Sci-fi, Supernatural, and Steampunk genres, often incorporating erotic elements into their work. With an impressive 36,702 statuses and a dedicated following of 955, they are known for their active engagement on the platform, though they do not engage in autofollowing. Despite their account not being verified, Darke_Conteur has cultivated a community of 258 friends, driven by an over-active Muse and a commitment to their craft, often found chained to their laptop.",2009-12-08 23:16:30+0000,955,258,['77357640'],[],[],[],"[1.4594594594594594, 1.2342342342342343, 1.4144144144144144, 1.2252252252252251, 1.3513513513513513, 1.3063063063063063, 0.4594594594594595, 0.36036036036036034, 0.35135135135135137, 0.36036036036036034, 0.3063063063063063, 0.5225225225225225, 1.0810810810810811, 1.4144144144144144, 1.5495495495495495, 2.135135135135135, 2.027027027027027, 2.0, 1.5585585585585586, 1.5675675675675675, 2.063063063063063, 1.2792792792792793, 1.2432432432432432, 1.3063063063063063]",[],"Darke_Conteur is a prolific author based in Kingston, Canada, specializing in Sci-fi, Supernatural, and Steampunk genres, often incorporating erotic elements into their work. With an impressive 36,702 statuses and a dedicated following of 955, they are known for their active engagement on the platform, though they do not engage in autofollowing. Despite their account not being verified, Darke_Conteur has cultivated a community of 258 friends, driven by an over-active Muse and a commitment to their craft, often found chained to their laptop."
8,81873794,Dale Estey,DaleEstey,"DaleEstey is a Canadian author known for crafting character-driven novels that feature exponential plots. With a substantial following of 1,095 and a network of 878 friends, Dale actively engages with the literary community, having posted 20,770 updates and favorited 1,797 tweets. Although the account is not verified, Dale's prolific presence reflects a deep commitment to storytelling.",2009-10-12 16:01:44+0000,1095,878,"['742143', '5402612']",[],[],[],"[1.4594594594594594, 1.2342342342342343, 1.4144144144144144, 1.2252252252252251, 1.3513513513513513, 1.3063063063063063, 0.4594594594594595, 0.36036036036036034, 0.35135135135135137, 0.36036036036036034, 0.3063063063063063, 0.5225225225225225, 1.0810810810810811, 1.4144144144144144, 1.5495495495495495, 2.135135135135135, 2.027027027027027, 2.0, 1.5585585585585586, 1.5675675675675675, 2.063063063063063, 1.2792792792792793, 1.2432432432432432, 1.3063063063063063]",[],"DaleEstey is a Canadian author known for crafting character-driven novels that feature exponential plots. With a substantial following of 1,095 and a network of 878 friends, Dale actively engages with the literary community, having posted 20,770 updates and favorited 1,797 tweets. Although the account is not verified, Dale's prolific presence reflects a deep commitment to storytelling."
9,203207703,The White crow,Gormanghast,"Gormanghast is a user based in Scotland with a vibrant online presence, boasting 2,192 statuses and 129 favorites. Although their account is not verified, they have a network of 131 friends and 101 followers, indicating an active engagement within their community.",2010-10-15 19:32:16+0000,101,131,['5402612'],[],[],[],"[1.4594594594594594, 1.2342342342342343, 1.4144144144144144, 1.2252252252252251, 1.3513513513513513, 1.3063063063063063, 0.4594594594594595, 0.36036036036036034, 0.35135135135135137, 0.36036036036036034, 0.3063063063063063, 0.5225225225225225, 1.0810810810810811, 1.4144144144144144, 1.5495495495495495, 2.135135135135135, 2.027027027027027, 2.0, 1.5585585585585586, 1.5675675675675675, 2.063063063063063, 1.2792792792792793, 1.2432432432432432, 1.3063063063063063]",[],"Gormanghast is a user based in Scotland with a vibrant online presence, boasting 2,192 statuses and 129 favorites. Although their account is not verified, they have a network of 131 friends and 101 followers, indicating an active engagement within their community."
10,43343657,Badass White Boy,Bodhisattva_ny,"Bodhisattva_ny, known as Lady K's Pool Boy, is an active social media user with a playful and unique persona. Residing 'In A Hay Loft', they have amassed a following of 1,178 and maintain a friend network of 2,001. With a prolific posting history of 33,070 statuses and a collection of 2,495 favorites, they engage frequently with their audience, despite their account not being verified.",2009-05-29 14:54:03+0000,1178,2001,[],[],[],[],"[1.4594594594594594, 1.2342342342342343, 1.4144144144144144, 1.2252252252252251, 1.3513513513513513, 1.3063063063063063, 0.4594594594594595, 0.36036036036036034, 0.35135135135135137, 0.36036036036036034, 0.3063063063063063, 0.5225225225225225, 1.0810810810810811, 1.4144144144144144, 1.5495495495495495, 2.135135135135135, 2.027027027027027, 2.0, 1.5585585585585586, 1.5675675675675675, 2.063063063063063, 1.2792792792792793, 1.2432432432432432, 1.3063063063063063]",[],"Bodhisattva_ny, known as Lady K's Pool Boy, is an active social media user with a playful and unique persona. Residing 'In A Hay Loft', they have amassed a following of 1,178 and maintain a friend network of 2,001. With a prolific posting history of 33,070 statuses and a collection of 2,495 favorites, they engage frequently with their audience, despite their account not being verified."
11,283388524,Abdul Rahman,Engr_AR,"Engr_AR is an Electrical & Electronics Engineer based in Pakistan, dedicated to supporting medical students by sharing medical-related e-books. With a substantial following of 1,140 and a friends count of 150, Engr_AR actively engages with the community, having posted 23,787 statuses and favorited 31,638 tweets. Although the account is not verified, their enthusiasm for education and collaboration is evident in their online presence.",2011-04-17 05:51:10+0000,1140,150,['742143'],[],[],[],"[1.4594594594594594, 1.2342342342342343, 1.4144144144144144, 1.2252252252252251, 1.3513513513513513, 1.3063063063063063, 0.4594594594594595, 0.36036036036036034, 0.35135135135135137, 0.36036036036036034, 0.3063063063063063, 0.5225225225225225, 1.0810810810810811, 1.4144144144144144, 1.5495495495495495, 2.135135135135135, 2.027027027027027, 2.0, 1.5585585585585586, 1.5675675675675675, 2.063063063063063, 1.2792792792792793, 1.2432432432432432, 1.3063063063063063]",[],"Engr_AR is an Electrical & Electronics Engineer based in Pakistan, dedicated to supporting medical students by sharing medical-related e-books. With a substantial following of 1,140 and a friends count of 150, Engr_AR actively engages with the community, having posted 23,787 statuses and favorited 31,638 tweets. Although the account is not verified, their enthusiasm for education and collaboration is evident in their online presence."
12,2817119726,Devon Jerome,devonysus,"Devonysus is a passionate professional tennis player and entrepreneur based in the United States. With a scholarly approach to life, they engage actively with their community, boasting 344 friends and 129 followers. Devonysus shares insights and experiences through 734 statuses and has a keen interest in various topics, as reflected in their 344 favorites. Although their account is not verified, they continue to build a vibrant online presence.",2014-09-18 14:22:43+0000,129,344,['5402612'],[],[],[],"[1.4594594594594594, 1.2342342342342343, 1.4144144144144144, 1.2252252252252251, 1.3513513513513513, 1.3063063063063063, 0.4594594594594595, 0.36036036036036034, 0.35135135135135137, 0.36036036036036034, 0.3063063063063063, 0.5225225225225225, 1.0810810810810811, 1.4144144144144144, 1.5495495495495495, 2.135135135135135, 2.027027027027027, 2.0, 1.5585585585585586, 1.5675675675675675, 2.063063063063063, 1.2792792792792793, 1.2432432432432432, 1.3063063063063063]",[],"Devonysus is a passionate professional tennis player and entrepreneur based in the United States. With a scholarly approach to life, they engage actively with their community, boasting 344 friends and 129 followers. Devonysus shares insights and experiences through 734 statuses and has a keen interest in various topics, as reflected in their 344 favorites. Although their account is not verified, they continue to build a vibrant online presence."
13,2299325254,Rob Jones,RobJonesRSJ,"RobJonesRSJ is an avid motor racing enthusiast based in Chislehurst, London. With a busy professional life working in the city, Rob enjoys making the most of his free time. Despite having a verified account status, he actively engages with a community of 465 friends and shares his thoughts through 1,105 statuses, while also appreciating 122 favorites.",2014-01-23 13:44:05+0000,82,465,['5402612'],[],[],[],"[1.4594594594594594, 1.2342342342342343, 1.4144144144144144, 1.2252252252252251, 1.3513513513513513, 1.3063063063063063, 0.4594594594594595, 0.36036036036036034, 0.35135135135135137, 0.36036036036036034, 0.3063063063063063, 0.5225225225225225, 1.0810810810810811, 1.4144144144144144, 1.5495495495495495, 2.135135135135135, 2.027027027027027, 2.0, 1.5585585585585586, 1.5675675675675675, 2.063063063063063, 1.2792792792792793, 1.2432432432432432, 1.3063063063063063]",[],"RobJonesRSJ is an avid motor racing enthusiast based in Chislehurst, London. With a busy professional life working in the city, Rob enjoys making the most of his free time. Despite having a verified account status, he actively engages with a community of 465 friends and shares his thoughts through 1,105 statuses, while also appreciating 122 favorites."
14,89835577,Richard Chong,RCyyz,"RCyyz is a social media user with 21 friends and 4 followers. They have posted a total of 33 updates but have not marked any posts as favorites. The account is not verified, and there is no location information provided.",2009-11-14 00:46:45+0000,4,21,"['742143', '5402612']",[],[],[],"[1.4594594594594594, 1.2342342342342343, 1.4144144144144144, 1.2252252252252251, 1.3513513513513513, 1.3063063063063063, 0.4594594594594595, 0.36036036036036034, 0.35135135135135137, 0.36036036036036034, 0.3063063063063063, 0.5225225225225225, 1.0810810810810811, 1.4144144144144144, 1.5495495495495495, 2.135135135135135, 2.027027027027027, 2.0, 1.5585585585585586, 1.5675675675675675, 2.063063063063063, 1.2792792792792793, 1.2432432432432432, 1.3063063063063063]",[],"RCyyz is a social media user with 21 friends and 4 followers. They have posted a total of 33 updates but have not marked any posts as favorites. The account is not verified, and there is no location information provided."
15,1591303436,anna,TattoqueenAnna,"TattoqueenAnna is a vibrant user from Errwere, known for her cool demeanor. Although her account is not verified, she has a solid following of 211 fans and a network of 341 friends. With 879 statuses shared and 8 favorites, she actively engages with her community.",2013-07-13 15:58:39+0000,211,341,['5402612'],[],[],[],"[1.4594594594594594, 1.2342342342342343, 1.4144144144144144, 1.2252252252252251, 1.3513513513513513, 1.3063063063063063, 0.4594594594594595, 0.36036036036036034, 0.35135135135135137, 0.36036036036036034, 0.3063063063063063, 0.5225225225225225, 1.0810810810810811, 1.4144144144144144, 1.5495495495495495, 2.135135135135135, 2.027027027027027, 2.0, 1.5585585585585586, 1.5675675675675675, 2.063063063063063, 1.2792792792792793, 1.2432432432432432, 1.3063063063063063]",[],"TattoqueenAnna is a vibrant user from Errwere, known for her cool demeanor. Although her account is not verified, she has a solid following of 211 fans and a network of 341 friends. With 879 statuses shared and 8 favorites, she actively engages with her community."
16,805358514,Kate Kaminska,katekaminska1,"User 'katekaminska1' is based in Ottawa, Canada, and actively engages in discussions related to STEM, SMEM, VOST, LESM, EM, digital humanities, big data, open data, crisis mapping, data visualization, security, disaster risk reduction, and resilience. With a following of 421 and 297 friends, they have posted 2,203 statuses and favorited 1,364 tweets. Their opinions are personal, and their account is not verified.",2012-09-05 20:52:51+0000,421,297,['594611438'],[],[],[],"[1.4594594594594594, 1.2342342342342343, 1.4144144144144144, 1.2252252252252251, 1.3513513513513513, 1.3063063063063063, 0.4594594594594595, 0.36036036036036034, 0.35135135135135137, 0.36036036036036034, 0.3063063063063063, 0.5225225225225225, 1.0810810810810811, 1.4144144144144144, 1.5495495495495495, 2.135135135135135, 2.027027027027027, 2.0, 1.5585585585585586, 1.5675675675675675, 2.063063063063063, 1.2792792792792793, 1.2432432432432432, 1.3063063063063063]",[],"User 'katekaminska1' is based in Ottawa, Canada, and actively engages in discussions related to STEM, SMEM, VOST, LESM, EM, digital humanities, big data, open data, crisis mapping, data visualization, security, disaster risk reduction, and resilience. With a following of 421 and 297 friends, they have posted 2,203 statuses and favorited 1,364 tweets. Their opinions are personal, and their account is not verified."
17,451548925,Nathan Archer,NathanAArcher,"NathanAArcher is a multifaceted individual based in Fairfax, VA. He is a male model, actor, director, author, and stock trader, showcasing his diverse talents and interests. As a Quidditch captain and a Computer Science major, Nathan demonstrates both leadership and a passion for technology. He hails from Oxford (Oxonian) and also engages in unique architectural projects as a hedge maze architect. Despite not having a verified account, he maintains a dynamic online presence with over 9,487 statuses and a following of 150, alongside 141 friends.",2011-12-31 17:22:31+0000,150,141,['742143'],[],[],[],"[1.4594594594594594, 1.2342342342342343, 1.4144144144144144, 1.2252252252252251, 1.3513513513513513, 1.3063063063063063, 0.4594594594594595, 0.36036036036036034, 0.35135135135135137, 0.36036036036036034, 0.3063063063063063, 0.5225225225225225, 1.0810810810810811, 1.4144144144144144, 1.5495495495495495, 2.135135135135135, 2.027027027027027, 2.0, 1.5585585585585586, 1.5675675675675675, 2.063063063063063, 1.2792792792792793, 1.2432432432432432, 1.3063063063063063]",[],"NathanAArcher is a multifaceted individual based in Fairfax, VA. He is a male model, actor, director, author, and stock trader, showcasing his diverse talents and interests. As a Quidditch captain and a Computer Science major, Nathan demonstrates both leadership and a passion for technology. He hails from Oxford (Oxonian) and also engages in unique architectural projects as a hedge maze architect. Despite not having a verified account, he maintains a dynamic online presence with over 9,487 statuses and a following of 150, alongside 141 friends."
