,user_id,name,username,description,created_at,followers_count,following_count,following_list,following_agentid_list,previous_tweets,tweets_id,activity_level_frequency,activity_level,user_char
0,872683897,#DramaAlert KEEMSTAR,KEEMSTARx,"KEEMSTARx is a prominent creator known for #DramaAlert, the leading source for news on social interactions within the gaming entertainment sphere. With a substantial following of 171,398 and an active engagement rate reflected in 44,833 statuses and 152,373 favorites, KEEMSTARx maintains a dynamic presence in the online community. Despite having a verified status, the account is popular among friends, boasting 537 connections.",2012-10-10 23:43:12+0000,171398,537,['306567446'],[],['ISIS -holding a Cafe hostage in Sydney- forcing Hostages to press ISIS flags against the Windows #DramaAlert HOT! http://t.co/XwXLvvWc76'],[],"[1.4594594594594594, 1.2342342342342343, 1.4144144144144144, 1.2252252252252251, 1.3513513513513513, 1.3063063063063063, 0.4594594594594595, 0.36036036036036034, 0.35135135135135137, 0.36036036036036034, 0.3063063063063063, 0.5225225225225225, 1.0810810810810811, 1.4144144144144144, 1.5495495495495495, 2.135135135135135, 2.027027027027027, 2.0, 1.5585585585585586, 1.5675675675675675, 2.063063063063063, 1.2792792792792793, 1.2432432432432432, 1.3063063063063063]",[],"KEEMSTARx is a prominent creator known for #DramaAlert, the leading source for news on social interactions within the gaming entertainment sphere. With a substantial following of 171,398 and an active engagement rate reflected in 44,833 statuses and 152,373 favorites, KEEMSTARx maintains a dynamic presence in the online community. Despite having a verified status, the account is popular among friends, boasting 537 connections."
1,1889895517,dAN.,chupaDANNNj,"User chupaDANNNj is a 18+ NSFW individual located in *O4L*. They have a following of 272 and are connected to 89 friends. With a total of 8710 statuses and 1053 favorites, their account is not verified.",2013-09-21 11:21:35+0000,272,89,"['193970285', '2735225486', '872683897']",[],[],[],"[1.4594594594594594, 1.2342342342342343, 1.4144144144144144, 1.2252252252252251, 1.3513513513513513, 1.3063063063063063, 0.4594594594594595, 0.36036036036036034, 0.35135135135135137, 0.36036036036036034, 0.3063063063063063, 0.5225225225225225, 1.0810810810810811, 1.4144144144144144, 1.5495495495495495, 2.135135135135135, 2.027027027027027, 2.0, 1.5585585585585586, 1.5675675675675675, 2.063063063063063, 1.2792792792792793, 1.2432432432432432, 1.3063063063063063]",[],"User chupaDANNNj is a 18+ NSFW individual located in *O4L*. They have a following of 272 and are connected to 89 friends. With a total of 8710 statuses and 1053 favorites, their account is not verified."
2,306567446,FaZe HugZ,FaZeHugZ,"FaZeHugZ, also known as Mick, is an 18-year-old British-Canadian university student and a proud member of FaZe Clan. Based in Canada, he engages with a large online community, boasting 136,040 followers and 550 friends. With a significant presence on social media, he has shared 16,902 statuses and has 1,496 favorites. Although his account is not verified, he actively promotes his affiliations with Scuf Gaming and Gfuel Energy, encouraging fans to follow him for updates and content.",2011-05-28 03:14:29+0000,136040,550,['872683897'],[],[],[],"[1.4594594594594594, 1.2342342342342343, 1.4144144144144144, 1.2252252252252251, 1.3513513513513513, 1.3063063063063063, 0.4594594594594595, 0.36036036036036034, 0.35135135135135137, 0.36036036036036034, 0.3063063063063063, 0.5225225225225225, 1.0810810810810811, 1.4144144144144144, 1.5495495495495495, 2.135135135135135, 2.027027027027027, 2.0, 1.5585585585585586, 1.5675675675675675, 2.063063063063063, 1.2792792792792793, 1.2432432432432432, 1.3063063063063063]",[],"FaZeHugZ, also known as Mick, is an 18-year-old British-Canadian university student and a proud member of FaZe Clan. Based in Canada, he engages with a large online community, boasting 136,040 followers and 550 friends. With a significant presence on social media, he has shared 16,902 statuses and has 1,496 favorites. Although his account is not verified, he actively promotes his affiliations with Scuf Gaming and Gfuel Energy, encouraging fans to follow him for updates and content."
3,796066422,Tyler▵,sxtynvne,"sxtynvne is an active social media user from Norwich, who has a strong affinity for Odd Future and shares a special connection with someone named Lauren. With a significant following of 3,080 and a friends count of 972, they engage frequently, having posted 27,381 statuses and favorited 4,284 tweets. Despite being an active participant on the platform, their account is not verified.",2012-09-01 13:19:12+0000,3080,972,[],[],[],[],"[1.4594594594594594, 1.2342342342342343, 1.4144144144144144, 1.2252252252252251, 1.3513513513513513, 1.3063063063063063, 0.4594594594594595, 0.36036036036036034, 0.35135135135135137, 0.36036036036036034, 0.3063063063063063, 0.5225225225225225, 1.0810810810810811, 1.4144144144144144, 1.5495495495495495, 2.135135135135135, 2.027027027027027, 2.0, 1.5585585585585586, 1.5675675675675675, 2.063063063063063, 1.2792792792792793, 1.2432432432432432, 1.3063063063063063]",[],"sxtynvne is an active social media user from Norwich, who has a strong affinity for Odd Future and shares a special connection with someone named Lauren. With a significant following of 3,080 and a friends count of 972, they engage frequently, having posted 27,381 statuses and favorited 4,284 tweets. Despite being an active participant on the platform, their account is not verified."
4,2916677139,Itz Kam,ImKamakase,"ImKamakase is a user with a modest social presence, having 7 friends and 2 followers. They have posted 4 statuses but have not favorited any content. Their account is not verified, and no location information is provided.",2014-12-12 01:50:56+0000,2,7,['872683897'],[],[],[],"[1.4594594594594594, 1.2342342342342343, 1.4144144144144144, 1.2252252252252251, 1.3513513513513513, 1.3063063063063063, 0.4594594594594595, 0.36036036036036034, 0.35135135135135137, 0.36036036036036034, 0.3063063063063063, 0.5225225225225225, 1.0810810810810811, 1.4144144144144144, 1.5495495495495495, 2.135135135135135, 2.027027027027027, 2.0, 1.5585585585585586, 1.5675675675675675, 2.063063063063063, 1.2792792792792793, 1.2432432432432432, 1.3063063063063063]",[],"ImKamakase is a user with a modest social presence, having 7 friends and 2 followers. They have posted 4 statuses but have not favorited any content. Their account is not verified, and no location information is provided."
5,193970285,Kris,Kiippyy,"Kiippyy, also known as Kris, is a photography enthusiast based in Vancouver. With a casual and friendly vibe, they engage actively on social media, having posted over 4,700 updates and accumulated 246 friends along with 89 followers. Though their account is not verified, Kris has shown a keen interest in curating content, amassing 1,261 likes on their favorites.",2010-09-23 03:04:44+0000,89,246,"['1889895517', '872683897']",[],[],[],"[1.4594594594594594, 1.2342342342342343, 1.4144144144144144, 1.2252252252252251, 1.3513513513513513, 1.3063063063063063, 0.4594594594594595, 0.36036036036036034, 0.35135135135135137, 0.36036036036036034, 0.3063063063063063, 0.5225225225225225, 1.0810810810810811, 1.4144144144144144, 1.5495495495495495, 2.135135135135135, 2.027027027027027, 2.0, 1.5585585585585586, 1.5675675675675675, 2.063063063063063, 1.2792792792792793, 1.2432432432432432, 1.3063063063063063]",[],"Kiippyy, also known as Kris, is a photography enthusiast based in Vancouver. With a casual and friendly vibe, they engage actively on social media, having posted over 4,700 updates and accumulated 246 friends along with 89 followers. Though their account is not verified, Kris has shown a keen interest in curating content, amassing 1,261 likes on their favorites."
